{"$schema":"https://json-schema.org/draft/2020-12/schema","$id":"https://novel-production-os.local/schemas/mutation-corpus.v1.schema.json","type":"object","additionalProperties":false,"required":["schema_version","corpus_id","oracle","gate_taxonomy","mutations","corpus_hash"],"properties":{"schema_version":{"const":"mutation-corpus.v1"},"corpus_id":{"type":"string"},"oracle":{"type":"object","additionalProperties":false,"required":["writer_id","writer_version","external_api_used","seed","controlled_correct_prose","controlled_correct_prose_hash"],"properties":{"writer_id":{"type":"string"},"writer_version":{"type":"string"},"external_api_used":{"const":false},"seed":{"type":"string"},"controlled_correct_prose":{"type":"string"},"controlled_correct_prose_hash":{"$ref":"#/$defs/hash"}}},"gate_taxonomy":{"type":"array","uniqueItems":true,"items":{"enum":["extraction","reconcile","hard_audit","human_review","calibrated_style"]}},"mutations":{"type":"array","minItems":10,"maxItems":10,"items":{"$ref":"#/$defs/mutation"}},"corpus_hash":{"$ref":"#/$defs/hash"}},"$defs":{"hash":{"type":"string","pattern":"^sha256:[0-9a-f]{64}$"},"variant":{"type":"object","additionalProperties":false,"required":["prose","prose_hash","expected_detected"],"properties":{"prose":{"type":"string"},"prose_hash":{"$ref":"#/$defs/hash"},"expected_detected":{"type":"boolean"}}},"mutation":{"type":"object","additionalProperties":false,"required":["sample_id","mutator_id","oracle_version","clean","mutated","expected_gate","expected_rule","oracle_assumptions","mutation_evidence","sample_hash"],"properties":{"sample_id":{"type":"string"},"mutator_id":{"enum":["KillThenAct","GhostCharacter","TimeReversal","KnowledgeLeak","PersonaDrift","HookRemoval","ForeshadowGhost","PowerJump","TropeRepeat","WordCountCheat"]},"oracle_version":{"const":"offline-writer.v1"},"clean":{"$ref":"#/$defs/variant"},"mutated":{"$ref":"#/$defs/variant"},"expected_gate":{"enum":["extraction","reconcile","hard_audit","human_review","calibrated_style"]},"expected_rule":{"type":"string"},"oracle_assumptions":{"type":"object"},"mutation_evidence":{"type":"object","additionalProperties":false,"required":["description","mutated_excerpt"],"properties":{"description":{"type":"string"},"mutated_excerpt":{"type":"string"}}},"sample_hash":{"$ref":"#/$defs/hash"}}}}}