{"corpus_hash":"sha256:2e59a7255201afd97b73c41098749c582800e02d37ddc90cf90f51553fd614f8","corpus_id":"m6_controlled_mutations_v1","gate_taxonomy":["calibrated_style","extraction","hard_audit","human_review","reconcile"],"mutations":[{"clean":{"expected_detected":false,"prose":"凌云的身份已经暴露。<!-- novel:claim {\"predicate\":\"status\",\"subject_id\":\"char_lin_yun\",\"value\":\"exposed\"} -->","prose_hash":"sha256:5307ceb6de47a230dbb83efbd4f323bcf2b808f5b9e5948db359487cb0d6e4b7"},"expected_gate":"hard_audit","expected_rule":"dead_actor","mutated":{"expected_detected":true,"prose":"亡者仍然挥剑。<!-- novel:claim {\"predicate\":\"acts\",\"subject_id\":\"char_dead\",\"value\":\"draws_sword\"} -->","prose_hash":"sha256:8dc7ac3251369512f35b7e40169deec1fe5c3aa525ad7804239331b3706b9c4e"},"mutation_evidence":{"description":"dead subject receives an action claim","mutated_excerpt":"亡者仍然挥剑。<!-- novel:claim {\"predicate\":\"acts\",\"subject_id\":\"char_dead\",\"value\":\"draws_sword\"} -->"},"mutator_id":"KillThenAct","oracle_assumptions":{"char_dead_status":"dead"},"oracle_version":"offline-writer.v1","sample_hash":"sha256:e0d06cd677d558f62bd2a84ae2f27618bfb5e2f93aeb6cb95fe3369db87c3586","sample_id":"mutation_01_killthenact"},{"clean":{"expected_detected":false,"prose":"凌云的身份已经暴露。<!-- novel:claim {\"predicate\":\"status\",\"subject_id\":\"char_lin_yun\",\"value\":\"exposed\"} -->","prose_hash":"sha256:5307ceb6de47a230dbb83efbd4f323bcf2b808f5b9e5948db359487cb0d6e4b7"},"expected_gate":"extraction","expected_rule":"unregistered_subject","mutated":{"expected_detected":true,"prose":"陌生人现身。<!-- novel:claim {\"predicate\":\"status\",\"subject_id\":\"char_ghost\",\"value\":\"active\"} -->","prose_hash":"sha256:c9b48024020ae43a3121a2d4feaf91edc6115cc0279cd49fe64dc2f828332068"},"mutation_evidence":{"description":"claim subject is absent from frozen objects","mutated_excerpt":"陌生人现身。<!-- novel:claim {\"predicate\":\"status\",\"subject_id\":\"char_ghost\",\"value\":\"active\"} -->"},"mutator_id":"GhostCharacter","oracle_assumptions":{"registered_objects_exclude":"char_ghost"},"oracle_version":"offline-writer.v1","sample_hash":"sha256:f99400754aa951790a7e99d11e0a2ae56b6fff1c003f573d8af3e0332498c2d3","sample_id":"mutation_02_ghostcharacter"},{"clean":{"expected_detected":false,"prose":"凌云的身份已经暴露。<!-- novel:claim {\"predicate\":\"status\",\"subject_id\":\"char_lin_yun\",\"value\":\"exposed\"} -->","prose_hash":"sha256:5307ceb6de47a230dbb83efbd4f323bcf2b808f5b9e5948db359487cb0d6e4b7"},"expected_gate":"hard_audit","expected_rule":"time_window","mutated":{"expected_detected":true,"prose":"时间退回开篇之前。<!-- novel:claim {\"predicate\":\"story_time\",\"subject_id\":\"char_lin_yun\",\"value\":\"story:0000\"} -->","prose_hash":"sha256:3417af1fff69f16abd4c37de79fc396fbc92df6e002357eb66c9bcf292dcc114"},"mutation_evidence":{"description":"story time falls before frozen chapter window","mutated_excerpt":"时间退回开篇之前。<!-- novel:claim {\"predicate\":\"story_time\",\"subject_id\":\"char_lin_yun\",\"value\":\"story:0000\"} -->"},"mutator_id":"TimeReversal","oracle_assumptions":{"chapter_window":["story:0001","story:0002"]},"oracle_version":"offline-writer.v1","sample_hash":"sha256:40c53fd97faae0163a583936e616a7b9a4140843c22d8fd2c159630484259c14","sample_id":"mutation_03_timereversal"},{"clean":{"expected_detected":false,"prose":"凌云的身份已经暴露。<!-- novel:claim {\"predicate\":\"status\",\"subject_id\":\"char_lin_yun\",\"value\":\"exposed\"} -->","prose_hash":"sha256:5307ceb6de47a230dbb83efbd4f323bcf2b808f5b9e5948db359487cb0d6e4b7"},"expected_gate":"hard_audit","expected_rule":"knowledge_boundary","mutated":{"expected_detected":true,"prose":"凌云说出了未知秘密。<!-- novel:claim {\"predicate\":\"knows\",\"subject_id\":\"char_lin_yun\",\"value\":\"fact_hidden_lineage\"} -->","prose_hash":"sha256:88af21e91b186e8e55ed172f64b0cd7fb574de4f98b628ba3ef57ba50d0110f2"},"mutation_evidence":{"description":"knowledge claim lacks frozen holder edge","mutated_excerpt":"凌云说出了未知秘密。<!-- novel:claim {\"predicate\":\"knows\",\"subject_id\":\"char_lin_yun\",\"value\":\"fact_hidden_lineage\"} -->"},"mutator_id":"KnowledgeLeak","oracle_assumptions":{"knowledge_edge_absent":["char_lin_yun","fact_hidden_lineage"]},"oracle_version":"offline-writer.v1","sample_hash":"sha256:fee85fb21bd2c3b16d5f492ba91c6a6ce7e92120c1cef17e6618e9fc85fd6a86","sample_id":"mutation_04_knowledgeleak"},{"clean":{"expected_detected":false,"prose":"凌云的身份已经暴露。<!-- novel:claim {\"predicate\":\"status\",\"subject_id\":\"char_lin_yun\",\"value\":\"exposed\"} -->","prose_hash":"sha256:5307ceb6de47a230dbb83efbd4f323bcf2b808f5b9e5948db359487cb0d6e4b7"},"expected_gate":"human_review","expected_rule":"persona_drift","mutated":{"expected_detected":true,"prose":"凌云突然以相反人格行事。<!-- novel:claim {\"predicate\":\"persona\",\"subject_id\":\"char_lin_yun\",\"value\":\"reckless_cruel\"} -->","prose_hash":"sha256:3eaeac5b6e9e2928e02ad314dbf86c7d72c40c85870024cf196fc5a7e89e330b"},"mutation_evidence":{"description":"persona differs from controlled baseline; deterministic detector not yet calibrated","mutated_excerpt":"凌云突然以相反人格行事。<!-- novel:claim {\"predicate\":\"persona\",\"subject_id\":\"char_lin_yun\",\"value\":\"reckless_cruel\"} -->"},"mutator_id":"PersonaDrift","oracle_assumptions":{"persona_baseline":"cautious_compassionate"},"oracle_version":"offline-writer.v1","sample_hash":"sha256:fc90ccfdf36cdfccbebfc9e07bf008ed701ec6a18a89304cc48bfef4f0e59036","sample_id":"mutation_05_personadrift"},{"clean":{"expected_detected":false,"prose":"凌云的身份已经暴露。<!-- novel:claim {\"predicate\":\"status\",\"subject_id\":\"char_lin_yun\",\"value\":\"exposed\"} -->","prose_hash":"sha256:5307ceb6de47a230dbb83efbd4f323bcf2b808f5b9e5948db359487cb0d6e4b7"},"expected_gate":"reconcile","expected_rule":"intent_missing","mutated":{"expected_detected":true,"prose":"凌云只是沉默。","prose_hash":"sha256:2c750e71bb069aedceca7ccd1e6bcac95c86a80ed1f35b3ee6e1c60e5d699acc"},"mutation_evidence":{"description":"required change annotation and fulfillment are removed","mutated_excerpt":"凌云只是沉默。"},"mutator_id":"HookRemoval","oracle_assumptions":{"required_change":"char_lin_yun.status=exposed"},"oracle_version":"offline-writer.v1","sample_hash":"sha256:0467304a2611dc0dd9b3775a60c8496c65f7d4747e93f512c9972a772a2260e8","sample_id":"mutation_06_hookremoval"},{"clean":{"expected_detected":false,"prose":"凌云的身份已经暴露。<!-- novel:claim {\"predicate\":\"status\",\"subject_id\":\"char_lin_yun\",\"value\":\"exposed\"} -->","prose_hash":"sha256:5307ceb6de47a230dbb83efbd4f323bcf2b808f5b9e5948db359487cb0d6e4b7"},"expected_gate":"hard_audit","expected_rule":"obligation_active","mutated":{"expected_detected":true,"prose":"不存在的伏笔被兑现。<!-- novel:claim {\"predicate\":\"obligation_touch\",\"subject_id\":\"char_lin_yun\",\"value\":\"obligation_missing\"} -->","prose_hash":"sha256:222972914bddaf1bd2b9d8a0a0223bec9acc972e72a57dbb92ec13dced0fe081"},"mutation_evidence":{"description":"claim touches an obligation absent from frozen open set","mutated_excerpt":"不存在的伏笔被兑现。<!-- novel:claim {\"predicate\":\"obligation_touch\",\"subject_id\":\"char_lin_yun\",\"value\":\"obligation_missing\"} -->"},"mutator_id":"ForeshadowGhost","oracle_assumptions":{"open_obligations_exclude":"obligation_missing"},"oracle_version":"offline-writer.v1","sample_hash":"sha256:9c710c51679c8240c8a42d5378c3b0a18f90610b1b76a8e0e6ce9d49ee589464","sample_id":"mutation_07_foreshadowghost"},{"clean":{"expected_detected":false,"prose":"凌云的身份已经暴露。<!-- novel:claim {\"predicate\":\"status\",\"subject_id\":\"char_lin_yun\",\"value\":\"exposed\"} -->","prose_hash":"sha256:5307ceb6de47a230dbb83efbd4f323bcf2b808f5b9e5948db359487cb0d6e4b7"},"expected_gate":"hard_audit","expected_rule":"capability_prerequisite","mutated":{"expected_detected":true,"prose":"凌云无前置地瞬移。<!-- novel:claim {\"predicate\":\"capability_use\",\"subject_id\":\"char_lin_yun\",\"value\":\"teleport\"} -->","prose_hash":"sha256:f3bd8b1ab9191d65c64eb43d132e2dd8222fe80e455534d70633221b71f07666"},"mutation_evidence":{"description":"capability use lacks frozen prerequisite","mutated_excerpt":"凌云无前置地瞬移。<!-- novel:claim {\"predicate\":\"capability_use\",\"subject_id\":\"char_lin_yun\",\"value\":\"teleport\"} -->"},"mutator_id":"PowerJump","oracle_assumptions":{"capabilities_exclude":"teleport"},"oracle_version":"offline-writer.v1","sample_hash":"sha256:b46e38b1bd30763e4051f2d36c9bb1d20d9d2b490ef8a247401f367753445d48","sample_id":"mutation_08_powerjump"},{"clean":{"expected_detected":false,"prose":"凌云的身份已经暴露。<!-- novel:claim {\"predicate\":\"status\",\"subject_id\":\"char_lin_yun\",\"value\":\"exposed\"} -->","prose_hash":"sha256:5307ceb6de47a230dbb83efbd4f323bcf2b808f5b9e5948db359487cb0d6e4b7"},"expected_gate":"calibrated_style","expected_rule":"trope_repeat","mutated":{"expected_detected":true,"prose":"危机突然出现。危机突然出现。危机突然出现。危机突然出现。危机突然出现。危机突然出现。危机突然出现。危机突然出现。<!-- novel:claim {\"predicate\":\"status\",\"subject_id\":\"char_lin_yun\",\"value\":\"exposed\"} -->","prose_hash":"sha256:1b46d8accb42b68ce93f5de9dbc3b72d07ee052e3cf43521403ae69e445ec2a3"},"mutation_evidence":{"description":"repeated trope phrase; threshold intentionally not supplied","mutated_excerpt":"危机突然出现。危机突然出现。危机突然出现。危机突然出现。危机突然出现。危机突然出现。危机突然出现。危机突然出现。<!-- novel:claim {\"predicate\":\"status\",\"subject_id\":\"char_lin_yun\",\"value\":\"exposed\"} -->"},"mutator_id":"TropeRepeat","oracle_assumptions":{"reference_ngram":"危机突然出现"},"oracle_version":"offline-writer.v1","sample_hash":"sha256:c662f9cd1727d2e6cf057536fbea2b14440eba72579a48c1f7045b7b7f861497","sample_id":"mutation_09_troperepeat"},{"clean":{"expected_detected":false,"prose":"凌云的身份已经暴露。<!-- novel:claim {\"predicate\":\"status\",\"subject_id\":\"char_lin_yun\",\"value\":\"exposed\"} -->","prose_hash":"sha256:5307ceb6de47a230dbb83efbd4f323bcf2b808f5b9e5948db359487cb0d6e4b7"},"expected_gate":"calibrated_style","expected_rule":"word_count_cheat","mutated":{"expected_detected":true,"prose":"其实。其实。其实。其实。其实。其实。其实。其实。其实。其实。其实。其实。其实。其实。其实。其实。其实。其实。其实。其实。其实。其实。其实。其实。其实。其实。其实。其实。其实。其实。其实。其实。其实。其实。其实。其实。其实。